{
  "appealList": [
    {
      "judge": "Mr Justice Smith",
      "time": "10am",
      "venue": "Court 1",
      "type": "Trial",
      "caseNumber": "CR-2026-000123",
      "caseName": "Acme v Widgets",
      "additionalInformation": "Listed for 1 day"
    }
  ],
  "businessList": [
    {
      "judge": "Mr Justice Smith",
      "time": "10am",
      "venue": "Court 1",
      "type": "Trial",
      "caseNumber": "CR-2026-000123",
      "caseName": "Acme v Widgets",
      "additionalInformation": "Listed for 1 day"
    }
  ],
  "commercialCourt": [
    {
      "judge": "Mr Justice Smith",
      "time": "10am",
      "venue": "Court 1",
      "type": "Trial",
      "caseNumber": "CR-2026-000123",
      "caseName": "Acme v Widgets",
      "additionalInformation": "Listed for 1 day"
    }
  ],
  "financialList": [
    {
      "judge": "Mr Justice Smith",
      "time": "10am",
      "venue": "Court 1",
      "type": "Trial",
      "caseNumber": "CR-2026-000123",
      "caseName": "Acme v Widgets",
      "additionalInformation": "Listed for 1 day"
    }
  ],
  "insolvency&CompaniesCourt": [
    {
      "judge": "Mr Justice Smith",
      "time": "10am",
      "venue": "Court 1",
      "type": "Trial",
      "caseNumber": "CR-2026-000123",
      "caseName": "Acme v Widgets",
      "additionalInformation": "Listed for 1 day"
    }
  ],
  "ip&EnterpriseCourt": [
    {
      "judge": "Mr Justice Smith",
      "time": "10am",
      "venue": "Court 1",
      "type": "Trial",
      "caseNumber": "CR-2026-000123",
      "caseName": "Acme v Widgets",
      "additionalInformation": "Listed for 1 day"
    }
  ],
  "intellectualPropertyList": [
    {
      "judge": "Mr Justice Smith",
      "time": "10am",
      "venue": "Court 1",
      "type": "Trial",
      "caseNumber": "CR-2026-000123",
      "caseName": "Acme v Widgets",
      "additionalInformation": "Listed for 1 day"
    }
  ],
  "londonCircuitCommercialCourt": [
    {
      "judge": "Mr Justice Smith",
      "time": "10am",
      "venue": "Court 1",
      "type": "Trial",
      "caseNumber": "CR-2026-000123",
      "caseName": "Acme v Widgets",
      "additionalInformation": "Listed for 1 day"
    }
  ],
  "patentsCourt": [
    {
      "judge": "Mr Justice Smith",
      "time": "10am",
      "venue": "Court 1",
      "type": "Trial",
      "caseNumber": "CR-2026-000123",
      "caseName": "Acme v Widgets",
      "additionalInformation": "Listed for 1 day"
    }
  ],
  "property,Trusts&ProbateList": [
    {
      "judge": "Mr Justice Smith",
      "time": "10am",
      "venue": "Court 1",
      "type": "Trial",
      "caseNumber": "CR-2026-000123",
      "caseName": "Acme v Widgets",
      "additionalInformation": "Listed for 1 day"
    }
  ],
  "technology&ConstructionCourt": [
    {
      "judge": "Mr Justice Smith",
      "time": "10am",
      "venue": "Court 1",
      "type": "Trial",
      "caseNumber": "CR-2026-000123",
      "caseName": "Acme v Widgets",
      "additionalInformation": "Listed for 1 day"
    }
  ],
  "admiraltyCourt": [
    {
      "judge": "Mr Justice Smith",
      "time": "10am",
      "venue": "Court 1",
      "type": "Trial",
      "caseNumber": "CR-2026-000123",
      "caseName": "Acme v Widgets",
      "additionalInformation": "Listed for 1 day"
    }
  ],
  "companiesWindingUp": [
    {
      "judge": "Mr Justice Smith",
      "time": "10am",
      "venue": "Court 1",
      "type": "Trial",
      "caseNumber": "CR-2026-000123",
      "caseName": "Acme v Widgets",
      "additionalInformation": "Listed for 1 day"
    }
  ],
  "competitionList": [
    {
      "judge": "Mr Justice Smith",
      "time": "10am",
      "venue": "Court 1",
      "type": "Trial",
      "caseNumber": "CR-2026-000123",
      "caseName": "Acme v Widgets",
      "additionalInformation": "Listed for 1 day"
    }
  ],
  "pensionsList": [
    {
      "judge": "Mr Justice Smith",
      "time": "10am",
      "venue": "Court 1",
      "type": "Trial",
      "caseNumber": "CR-2026-000123",
      "caseName": "Acme v Widgets",
      "additionalInformation": "Listed for 1 day"
    }
  ],
  "revenueList": [
    {
      "judge": "Mr Justice Smith",
      "time": "10am",
      "venue": "Court 1",
      "type": "Trial",
      "caseNumber": "CR-2026-000123",
      "caseName": "Acme v Widgets",
      "additionalInformation": "Listed for 1 day"
    }
  ]
}
